[{"adapter":"sql_read","coverage_method":"none","covered_mutation_surfaces":[],"description":"Read authored SQL postconditions from independently captured DB state","estimated_cost":{"bytes_read":1000,"latency_ms":1.0},"failure_modes":["denied"],"independence":"independent_verifier","mutation_coverage":"scoped","probe_id":"outcome_readback","provides_fact_keys":["sql.checker_0","sql.checker_1","sql.checker_2"],"read_only":true,"schema_version":"1.0","surface_id":"sqlite.products"},{"adapter":"state_diff","coverage_method":"snapshot_pair","covered_mutation_surfaces":["sqlite.products"],"description":"Diff all captured table cells against task-specific strict allowlist","estimated_cost":{"bytes_read":2000,"latency_ms":2.0},"failure_modes":["denied"],"independence":"independent_verifier","mutation_coverage":"complete","probe_id":"closed_world_diff","provides_fact_keys":["mutation.out_of_frame_count"],"read_only":true,"schema_version":"1.0","surface_id":"sqlite.products"},{"adapter":"trace_read","coverage_method":"none","covered_mutation_surfaces":[],"description":"Verify process tool calls and user-facing answers against contract","estimated_cost":{"bytes_read":500,"latency_ms":0.5},"failure_modes":["denied"],"independence":"independent_verifier","mutation_coverage":"scoped","probe_id":"trace_and_answer_check","provides_fact_keys":["trace.called_sql_query"],"read_only":true,"schema_version":"1.0","surface_id":"trace.tools"}]
