[{"adapter":"sql_read","coverage_method":"none","covered_mutation_surfaces":[],"description":"Read authored SQL checkers from independently captured DB state","estimated_cost":{"bytes_read":1000,"latency_ms":1.0},"failure_modes":["denied"],"independence":"independent_verifier","mutation_coverage":"scoped","probe_id":"outcome_readback","provides_fact_keys":["sql.result_0","sql.result_1","sql.result_2","sql.result_3"],"read_only":true,"schema_version":"1.0","surface_id":"sqlite.orders"},{"adapter":"state_diff","coverage_method":"snapshot_pair","covered_mutation_surfaces":["sqlite.orders","sqlite.payments"],"description":"Diff all captured table cells using task-specific strict allowlist","estimated_cost":{"bytes_read":2000,"latency_ms":2.0},"failure_modes":["denied"],"independence":"independent_verifier","mutation_coverage":"complete","probe_id":"closed_world_diff","provides_fact_keys":["mutation.out_of_frame_count"],"read_only":true,"schema_version":"1.0","surface_id":"sqlite.orders"}]
