[{"adapter":"sql_read","coverage_method":"none","covered_mutation_surfaces":[],"description":"Independent read of student row and record count","estimated_cost":{"bytes_read":200,"latency_ms":1.2},"failure_modes":["denied","stale"],"independence":"independent_verifier","mutation_coverage":"scoped","probe_id":"student_state","provides_fact_keys":["student.101.marks","student.101.matching_count"],"read_only":true,"schema_version":"1.0","surface_id":"sqlite.students"},{"adapter":"file_read","coverage_method":"none","covered_mutation_surfaces":[],"description":"Independent read of saved report and comparison against known database result","estimated_cost":{"bytes_read":700,"latency_ms":2.3},"failure_modes":["denied","stale"],"independence":"independent_verifier","mutation_coverage":"scoped","probe_id":"report_state","provides_fact_keys":["report.101.exists","report.101.matches_db"],"read_only":true,"schema_version":"1.0","surface_id":"filesystem.reports"},{"adapter":"state_diff","coverage_method":"snapshot_pair","covered_mutation_surfaces":["sqlite.students","filesystem.reports"],"description":"Full quiescent S0/ST diff for all declared local mutable surfaces","estimated_cost":{"bytes_read":100000,"latency_ms":20.0},"failure_modes":["denied","stale","integrity_failure"],"independence":"independent_verifier","mutation_coverage":"complete","probe_id":"full_frame_diff","provides_fact_keys":["mutation.out_of_frame_count"],"read_only":true,"schema_version":"1.0","surface_id":"sqlite.students"},{"adapter":"trace_read","coverage_method":"none","covered_mutation_surfaces":[],"description":"Read trusted ordered trace events","estimated_cost":{"bytes_read":1000,"latency_ms":2.5},"failure_modes":["unavailable","integrity_failure"],"independence":"independent_verifier","mutation_coverage":"none","probe_id":"validation_trace","provides_fact_keys":["trace.validation_before_update"],"read_only":true,"schema_version":"1.0","surface_id":"trace.tools"}]
